{
    "meta": {
        "version": "1.0.0",
        "lastUpdated": "2026-02-04T18:00:00+09:00",
        "updatedBy": "engineer@example.com"
    },
    "screen_registry": {
        "global": {
            "name": "全体",
            "routes": []
        },
        "yield_personal": {
            "name": "歩留まり（個人）",
            "routes": [
                "/pages/yield-personal",
                "/yield-personal"
            ],
            "group": "yield"
        },
        "yield_company": {
            "name": "歩留まり（企業）",
            "routes": [
                "/pages/yield-company",
                "/yield-company"
            ],
            "group": "yield"
        },
        "yield_admin": {
            "name": "歩留まり（管理）",
            "routes": [
                "/pages/yield-admin",
                "/yield-admin"
            ],
            "group": "yield"
        },
        "settings_main": {
            "name": "設定",
            "routes": [
                "/pages/settings",
                "/settings"
            ],
            "group": "settings"
        },
        "members_list": {
            "name": "メンバー一覧",
            "routes": [
                "/pages/members",
                "/members"
            ],
            "group": "members"
        },
        "teleapo": {
            "name": "架電管理",
            "routes": [
                "/teleapo",
                "/pages/teleapo"
            ],
            "group": "teleapo"
        },
        "referral": {
            "name": "紹介先企業管理",
            "routes": [
                "/referral",
                "/pages/referral"
            ],
            "group": "referral"
        },
        "ad_performance": {
            "name": "広告管理",
            "routes": [
                "/ad-performance",
                "/pages/ad-performance"
            ],
            "group": "ad"
        },
        "candidates": {
            "name": "候補者管理",
            "routes": [
                "/candidates",
                "/pages/candidates"
            ],
            "group": "candidates"
        },
        "goal_settings": {
            "name": "評価・目標設定",
            "routes": [
                "/goal-settings",
                "/pages/goal-settings"
            ],
            "group": "settings"
        }
    },
    "system_messages": {
        "welcome": "こんにちは！ヘルプボットです。何かお困りですか？",
        "not_found": "該当する回答が見つかりませんでした。",
        "search_prompt": "検索キーワードを入力してください（2文字以上）",
        "search_too_short": "2文字以上で入力してください。",
        "search_results": "「{query}」の検索結果です（{count}件）。",
        "search_no_result": "「{query}」に該当する項目がありませんでした。",
        "select_from_options": "選択肢からお選びください。",
        "category_empty": "この項目には該当するヘルプがありません。",
        "error": "エラーが発生しました。もう一度お試しください。",
        "error_session_expired": "セッションが期限切れです。画面を再読み込みしてください。"
    },
    "menus": {
        "home:global": {
            "message": "こんにちは！何かお困りですか？",
            "options": [
                {
                    "label": "よくある質問",
                    "next_state": "cat:faq:global"
                },
                {
                    "label": "使い方",
                    "next_state": "cat:howto:global"
                },
                {
                    "label": "用語",
                    "next_state": "cat:glossary:global"
                },
                {
                    "label": "エラー/困りごと",
                    "next_state": "cat:error:global"
                },
                {
                    "label": "全体ヘルプ",
                    "next_state": "cat:general:global"
                }
            ]
        },
        "home:yield_personal": {
            "message": "歩留まり（個人）のヘルプです。何かお困りですか？",
            "options": [
                {
                    "label": "よくある質問",
                    "next_state": "cat:faq:yield_personal"
                },
                {
                    "label": "使い方",
                    "next_state": "cat:howto:yield_personal"
                },
                {
                    "label": "用語",
                    "next_state": "cat:glossary:yield_personal"
                },
                {
                    "label": "エラー/困りごと",
                    "next_state": "cat:error:yield_personal"
                },
                {
                    "label": "全体ヘルプ",
                    "next_state": "cat:general:yield_personal"
                },
                {
                    "label": "歩留まりメニューに戻る",
                    "next_state": "menu:watarimari"
                }
            ]
        },
        "home:yield_company": {
            "message": "歩留まり（企業）のヘルプです。何かお困りですか？",
            "options": [
                {
                    "label": "よくある質問",
                    "next_state": "cat:faq:yield_company"
                },
                {
                    "label": "使い方",
                    "next_state": "cat:howto:yield_company"
                },
                {
                    "label": "用語",
                    "next_state": "cat:glossary:yield_company"
                },
                {
                    "label": "エラー/困りごと",
                    "next_state": "cat:error:yield_company"
                },
                {
                    "label": "全体ヘルプ",
                    "next_state": "cat:general:yield_company"
                },
                {
                    "label": "歩留まりメニューに戻る",
                    "next_state": "menu:watarimari"
                }
            ]
        },
        "home:yield_admin": {
            "message": "歩留まり（管理）のヘルプです。何かお困りですか？",
            "options": [
                {
                    "label": "よくある質問",
                    "next_state": "cat:faq:yield_admin"
                },
                {
                    "label": "使い方",
                    "next_state": "cat:howto:yield_admin"
                },
                {
                    "label": "用語",
                    "next_state": "cat:glossary:yield_admin"
                },
                {
                    "label": "エラー/困りごと",
                    "next_state": "cat:error:yield_admin"
                },
                {
                    "label": "全体ヘルプ",
                    "next_state": "cat:general:yield_admin"
                },
                {
                    "label": "歩留まりメニューに戻る",
                    "next_state": "menu:watarimari"
                }
            ]
        },
        "home:settings_main": {
            "message": "設定のヘルプです。何かお困りですか？",
            "options": [
                {
                    "label": "よくある質問",
                    "next_state": "cat:faq:settings_main"
                },
                {
                    "label": "使い方",
                    "next_state": "cat:howto:settings_main"
                },
                {
                    "label": "用語",
                    "next_state": "cat:glossary:settings_main"
                },
                {
                    "label": "エラー/困りごと",
                    "next_state": "cat:error:settings_main"
                },
                {
                    "label": "全体ヘルプ",
                    "next_state": "cat:general:settings_main"
                },
                {
                    "label": "設定メニューに戻る",
                    "next_state": "menu:settings"
                }
            ]
        },
        "home:members_list": {
            "message": "メンバー一覧のヘルプです。何かお困りですか？",
            "options": [
                {
                    "label": "よくある質問",
                    "next_state": "cat:faq:members_list"
                },
                {
                    "label": "使い方",
                    "next_state": "cat:howto:members_list"
                },
                {
                    "label": "用語",
                    "next_state": "cat:glossary:members_list"
                },
                {
                    "label": "エラー/困りごと",
                    "next_state": "cat:error:members_list"
                },
                {
                    "label": "全体ヘルプ",
                    "next_state": "cat:general:members_list"
                }
            ]
        },
        "menu:watarimari": {
            "message": "歩留まり関連の画面を選択してください。",
            "options": [
                {
                    "label": "歩留まり（個人）へ",
                    "next_state": "home:yield_personal"
                },
                {
                    "label": "歩留まり（企業）へ",
                    "next_state": "home:yield_company"
                },
                {
                    "label": "歩留まり（管理）へ",
                    "next_state": "home:yield_admin"
                }
            ]
        },
        "menu:settings": {
            "message": "設定関連の画面を選択してください。",
            "options": [
                {
                    "label": "設定（メイン）へ",
                    "next_state": "home:settings_main"
                }
            ]
        },
        "cat:faq:yield_personal": {
            "message": "歩留まり（個人）のよくある質問です。",
            "options": [
                {
                    "label": "データの更新頻度は？",
                    "next_state": "ans:item_003"
                },
                {
                    "label": "自分のデータだけ見たい",
                    "next_state": "ans:item_011"
                }
            ]
        },
        "cat:howto:yield_personal": {
            "message": "歩留まり（個人）の使い方です。",
            "options": [
                {
                    "label": "グラフの見方",
                    "next_state": "ans:item_004"
                },
                {
                    "label": "CSVでエクスポートしたい",
                    "next_state": "ans:item_006"
                }
            ]
        },
        "cat:glossary:yield_personal": {
            "message": "歩留まり関連の用語です。",
            "options": [
                {
                    "label": "歩留まりとは？",
                    "next_state": "ans:item_001"
                },
                {